{"attempts":[{"attempt":1,"callId":"c1","model":{"model":"m","provider":"fixture"},"operationId":"op-2","queueMs":0,"role":"collate","settledAtMs":10,"startedAtMs":0,"state":"succeeded"}],"coverage":"all-model-work-settled","manifestSha256":"410604b74cd55528842050c2a2246eb1e1187c4563575441a65e66e2472d5cc6","namespaceId":"0123456789abcdef0123456789abcdef","runId":"2026-10-18-example-run-store-query-22222222222222222222222222222222","schema":"intelli-v1/accounting","schemaVersion":1,"summary":{"attempts":1,"costComplete":false,"estimatedCost":{},"missingAttempts":1,"missingTokenFields":["inputTotal","inputUncached","outputTotal","cacheRead","cacheWrite","cacheWrite1h","reasoning","totalTokens"],"observedAttempts":0,"parentDelivery":"unknown","reportedCost":{},"tokens":{}}}
